{
  "profile_id": "codex-baseline",
  "harness": "codex",
  "model_id": "gpt-5.6-sol",
  "command": [
    "/Users/thorbthorb/.nvm/versions/node/v22.22.0/bin/codex",
    "exec",
    "--json",
    "--ephemeral",
    "--ignore-user-config",
    "--ignore-rules",
    "--strict-config",
    "--skip-git-repo-check",
    "--sandbox",
    "workspace-write",
    "--model",
    "gpt-5.6-sol",
    "--config=model_provider=\"openai\"",
    "--config=model_reasoning_effort=\"xhigh\"",
    "--config=personality=\"none\"",
    "--config=approval_policy=\"never\"",
    "--config=web_search=\"disabled\"",
    "--config=mcp_servers={}",
    "--config=plugins={}",
    "--config=marketplaces={}",
    "--config=features.memories=false",
    "--config=features.multi_agent=false",
    "--config=features.apps=false",
    "--config=features.browser_use=false",
    "--config=features.computer_use=false",
    "--config=features.image_generation=false",
    "--color",
    "never",
    "-"
  ],
  "instructions": "Work only in the visible task workspace. Inspect the task and starter files, implement the required outputs, run available local checks, and leave the final artifacts in place. Do not claim success without executed evidence.",
  "skills": [],
  "mcps": [],
  "tools": [
    "shell",
    "edit"
  ],
  "environment_keys": [],
  "time_limit_seconds": 300,
  "observable_cost_usd": null
}
